{
  "$schema": "https://json-schema.org/draft/2020-12/schema",
  "$id": "https://raw.githubusercontent.com/openwallet-foundation-labs/eudiplo/refs/heads/main/schemas/KeyChainExportDto.schema.json",
  "title": "KeyChainExportDto",
  "type": "object",
  "properties": {
    "id": {
      "type": "string",
      "description": "Key chain ID."
    },
    "description": {
      "type": "string",
      "description": "Human-readable description."
    },
    "usageType": {
      "enum": [
        "access",
        "attestation",
        "trustList",
        "statusList",
        "encrypt"
      ],
      "type": "string",
      "description": "Usage type for this key chain."
    },
    "key": {
      "description": "The private key in JWK format (EC).",
      "allOf": [
        {
          "$ref": "./ExportEcJwk.schema.json"
        }
      ]
    },
    "crt": {
      "description": "Certificate chain in PEM format (leaf first, then intermediates/CA).",
      "type": "array",
      "items": {
        "type": "string"
      }
    },
    "kmsProvider": {
      "type": "string",
      "description": "KMS provider name."
    },
    "rotationPolicy": {
      "description": "Rotation policy.",
      "allOf": [
        {
          "$ref": "./ExportRotationPolicyDto.schema.json"
        }
      ]
    }
  },
  "required": [
    "id",
    "usageType",
    "key"
  ],
  "additionalProperties": false
}