{
    "id": "570852d7-7e7f-40af-a0e3-a6ebffd75ed0",
    "description": "Key chain for trust list signing",
    "usageType": "trustList",
    "key": {
        "crv": "P-256",
        "d": "_iZzAnnFH_HsBzDG_hk8qpTQmh_sCwhPpvebVNjhe2A",
        "kty": "EC",
        "x": "MhpvX9dEM8NsXM-c6474d2uHrPRWrVD4WZGtVvxfQhk",
        "y": "q_uS4tQZSKu22_YgTlEFjuNdz-e-uNHzW1-x_VLicco",
        "alg": "ES256"
    }
}