{
    "id": "2f71c235-87e2-43c9-b572-739a3164ce95",
    "description": "Access Certificate",
    "usageType": "access",
    "key": {
        "kty": "EC",
        "x": "XhUejp-xQ_Dk0dRpg8PBFr0viFpdI_nmErMWjzOnOEg",
        "y": "TfvSjR63Ohj8HpiBkVm0FaieKmahFNJC4IfXZtL14PQ",
        "crv": "P-256",
        "d": "878XDi2iZi860bluRn4j1Ib3zlzYIaUN2q1qklhmA90",
        "kid": "2f71c235-87e2-43c9-b572-739a3164ce95-active"
    },
    "kmsProvider": "db",
    "crt": [
        "-----BEGIN CERTIFICATE-----\nMIIBqDCCAU6gAwIBAgIRAKvmiMRB5R7lA5jLGSWb+t0wCgYIKoZIzj0EAwIwIzEL\nMAkGA1UEBhMCREUxFDASBgNVBAMTC0RlbW8gVGVuYW50MB4XDTI2MDMwOTExMDM1\nN1oXDTI3MDMwOTExMDM1N1owIzELMAkGA1UEBhMCREUxFDASBgNVBAMTC0RlbW8g\nVGVuYW50MFkwEwYHKoZIzj0CAQYIKoZIzj0DAQcDQgAEXhUejp+xQ/Dk0dRpg8PB\nFr0viFpdI/nmErMWjzOnOEhN+9KNHrc6GPwemIGRWbQVqJ4qZqEU0kLgh9dm0vXg\n9KNjMGEwIgYDVR0RBBswGYIXc2VydmljZS5ldWRpLXdhbGxldC5kZXYwDAYDVR0T\nAQH/BAIwADAOBgNVHQ8BAf8EBAMCBaAwHQYDVR0OBBYEFJ/qrJtPiM+jlZzxig8f\nVugUZLHYMAoGCCqGSM49BAMCA0gAMEUCIQDxZTfmEZ6XXETPk5iQHRqpPmhJYMpB\n3KZ/XzNBTbC8OAIgZwa4rpELbnfCweRNhC0JjZ/sVZl1TPgBd11N56l7r34=\n-----END CERTIFICATE-----"
    ]
}