{
    "id": "2f71c235-87e2-43c9-b572-739a3164ce95",
    "description": "Access Certificate",
    "usageType": "access",
    "key": {
        "kty": "EC",
        "d": "b1Nk_prAR2udPFChAJ8pbTwUBt9Zq1tzaj0Ne-dfrp8",
        "crv": "P-256",
        "kid": "uuWo4gA4g2sQaUZ2qEKZBWALQgV6b8ELdlmrGs_K6AQ",
        "x": "ivEpyhAg_v46FidKof51sMyA6DfV_c3h7QUhNWMPVvc",
        "y": "yLqfG8wLPX_uQCbYbTqAE4ltXKX51u56b0oubwnJFxs"
    },
    "kmsProvider": "db",
    "crt": [
        "-----BEGIN CERTIFICATE-----\nMIIBdjCCARugAwIBAgIBAjAKBggqhkjOPQQDAjAXMRUwEwYDVQQDEwxPSURGIFRl\nc3QgQ0EwHhcNMjYwNDI3MjIxMDUxWhcNMjcwNDI3MjIxMDUxWjAbMRkwFwYDVQQD\nExBPSURGIFRlc3QgQ2xpZW50MFkwEwYHKoZIzj0CAQYIKoZIzj0DAQcDQgAEivEp\nyhAg/v46FidKof51sMyA6DfV/c3h7QUhNWMPVvfIup8bzAs9f+5AJthtOoATiW1c\npfnW7npvSi5vCckXG6NUMFIwDAYDVR0TAQH/BAIwADAOBgNVHQ8BAf8EBAMCB4Aw\nMgYDVR0RBCswKYIJbG9jYWxob3N0ghxob3N0LnRlc3Rjb250YWluZXJzLmludGVy\nbmFsMAoGCCqGSM49BAMCA0kAMEYCIQCqqt0Opn2KZAZ+ErMbYdUlFeiPSywV+J4L\nW2bWN+hEdQIhAP8cYGpiywdTNOiQZHEtoRb0E+XXQGsrtf96qkFCapoV\n-----END CERTIFICATE-----"
    ]
}