{
    "id": "dbb65456-c358-46c1-bb5b-c777ef72c1d4",
    "description": "key for status list signing",
    "usageType": "statusList",
    "key": {
        "crv": "P-256",
        "d": "oXPLTk02Mq9n8GfOTQ8hdoe3ENkNoN_Y2ymLnUmnbV0",
        "kty": "EC",
        "x": "HHkkbUgKSkkqXmL8utl-TLWIg8CYQS4WPJ8j_nO44Yw",
        "y": "1NJY0LT3mEuucLQCZJWNrA7fVW8ypR4Zf5cuu85NjSw",
        "alg": "ES256"
    },
    "kmsProvider": "db",
    "rotationPolicy": {
        "certValidityDays": 30,
        "enabled": true
    }
}